filename,source_row_index,headline,qui_tam_score,reason,key_facts,statute_violations,implicated_actors,federal_programs_involved,fraud_type
offlabel_0,1,"Potential off‑label marketing violations involving a drug with 703 adverse event reports and 139 indications, but no evidence of Medicare/Medicaid billing",20,"The record indicates a high volume of adverse events and many indications, suggesting possible off‑label marketing. However, there is no mention of Medicare or Medicaid billing, which is required for a False Claims Act claim. The case may be viable under the FDCA but not as a qui tam action.","703 adverse event reports linked to an unknown drug; 139 distinct indications reported, indicating possible off‑label use; No mention of federal program billing or reimbursement claims",FDCA,Unknown drug manufacturer,,off-label marketing
offlabel_1,2,Potential off‑label prescribing of Lipitor with high adverse event volume that may implicate Medicare billing fraud,60,"The record shows 64 adverse event reports for Lipitor, a drug with known off‑label indications. While the data do not explicitly mention Medicare billing or false claims, the high event volume and indication diversity raise a plausible pattern of off‑label prescribing that could be billed to Medicare. The lack of public disclosure and the need for further verification of billing practices place this case in the medium‑potential range.","64 adverse event reports for Lipitor in FDA FAERS; 4 distinct indications reported, suggesting off‑label use; Serious outcomes include 4 deaths, 1 life‑threatening event, and other severe events; No explicit Medicare billing data provided in the record",False Claims Act; Anti-Kickback Statute,Lipitor,,other
offlabel_2,3,"Potential off‑label marketing of JAKAFI with high adverse event volume and multiple indications, raising FDCA and False Claims Act concerns",85,"The record shows 50 adverse event reports linked to JAKAFI across five indications, indicating a systematic off‑label prescribing pattern. The high event volume and indication diversity suggest a deliberate marketing strategy that could have led to Medicare billing for non‑approved uses, creating strong FDCA and False Claims Act exposure. No public settlement or DOJ announcement is noted, keeping the first‑to‑file window open.","50 adverse event reports for JAKAFI in FDA FAERS; Reports span five distinct indications, none of which are FDA‑approved for JAKAFI; Serious outcomes reported in 5 of the 50 cases, indicating potential patient harm; Record explicitly calls for verification of Medicare coverage and prescribing patterns; No public disclosure or settlement noted",False Claims Act; FDCA,JAKAFI; Healthcare providers prescribing JAKAFI,Medicare; Medicaid,off-label marketing
offlabel_3,4,"Potential off‑label marketing of Humira with high adverse event volume and multiple indications, raising FDCA and False Claims Act concerns",85,"The record shows 31 adverse event reports linked to Humira across 10 indications, indicating a systematic off‑label marketing pattern. The high event volume and indication diversity suggest that the drug was promoted for non‑approved uses, potentially leading to Medicare/Medicaid claims for services paid under false pretenses. No public disclosure or settlement is noted, and the case is recent enough to be within the 6‑year statute of limitations.","31 adverse event reports for Humira in FDA FAERS; 10 distinct indications suggesting off‑label use; Serious outcomes reported in 5 cases (e.g., death, hospitalization); No public settlement or DOJ announcement; Case status listed as unfiled",False Claims Act; FDCA,Humira; Healthcare providers prescribing the drug,Medicare; Medicaid,off-label marketing
offlabel_4,5,"Potential off‑label prescribing scheme for LETAIRIS with 28 adverse events across 12 indications, likely involving Medicare beneficiaries",85,"The record shows a sizable cluster of adverse events (28) linked to 12 different indications, indicating systematic off‑label prescribing. The high event volume and indication diversity suggest a pattern that could involve Medicare beneficiaries, creating a strong False Claims Act opportunity. No public disclosure or settlement is noted, and the case is recent enough to be within the 6‑year statute of limitations.","28 adverse event reports filed with FDA FAERS for LETAIRIS; Reports span 12 distinct indications, indicating off‑label use; Serious outcomes reported in multiple cases (5, 1, 3, 6); No public settlement or DOJ announcement noted; Case status listed as unfiled",False Claims Act; Anti-Kickback Statute,LETAIRIS manufacturer,Medicare,off-label marketing
offlabel_5,6,"Potential off‑label marketing of Depakote ER with high adverse event volume and multiple indications, creating a strong False Claims Act opportunity if Medicare billing is involved",82,"The FAERS data shows a significant number of adverse events (24) linked to 11 different indications, indicating systematic off‑label use. If Medicare claims were submitted for these services, the case would violate both the False Claims Act and the FDCA. No public settlement or DOJ announcement is noted, and the record is recent enough to be within the 6‑year statute of limitations.",24 adverse event reports linked to Depakote ER; 11 distinct indications suggesting off‑label prescribing; No public disclosure or settlement noted; Record marked as unfiled and recent,False Claims Act; FDCA,Depakote ER,Medicare,off-label marketing
offlabel_6,7,"Potential off‑label prescribing scheme for OMNISCAN with 22 adverse events across 13 indications, possibly involving Medicare patients",78,"The record shows a high volume of adverse events and multiple indications for OMNISCAN, suggesting systematic off‑label use. While Medicare involvement is not explicitly stated, the next steps recommend verifying coverage and prescribing patterns, indicating a likely federal program connection. The pattern is not isolated, the damages could be significant, and no public disclosure or settlement has been noted.","22 adverse event reports linked to OMNISCAN; 13 distinct indications, indicating off‑label use; Serious outcomes reported in 5 cases; Case flagged for verification of Medicare coverage and prescribing patterns; No public settlement or DOJ announcement",False Claims Act; Anti‑Kickback Statute; Stark Law,"OMNISCAN manufacturer , prescribing physicians, healthcare facilities",Medicare; Medicaid,off-label marketing
offlabel_7,8,Potential off‑label prednisone prescribing scheme with 18 adverse events across 7 indications that may involve Medicare billing,75,"The FAERS data show a moderate volume of adverse events linked to off‑label use of prednisone across multiple indications, suggesting a systematic pattern.  If Medicare claims were submitted for these off‑label services, the case could trigger both FDCA and False Claims Act liability.  The lack of public disclosure and the need for further verification keep the score high but not at slam‑dunk level.",18 adverse event reports linked to prednisone in FAERS; 5 serious outcomes among the 18 events; 7 distinct indications suggesting off‑label use; No public settlement or DOJ announcement reported,False Claims Act; FDCA,Prednisone,Medicare,off-label marketing / prescribing
offlabel_8,9,Potential off‑label acetaminophen prescribing that may involve Medicare patients,45,"The record indicates 17 adverse event reports for a drug with only one indication, suggesting possible off‑label use. However, there is no explicit mention of Medicare/Medicaid billing or documented claims fraud, and the adverse events alone do not establish a clear False Claims Act violation. The case would need further evidence of federal program involvement and billing patterns before it could be pursued.","17 adverse event reports for Amazon Basic Care Acetaminophen; Only one listed indication, implying potential off‑label use; No documented Medicare/Medicaid billing data provided",False Claims Act; FDCA,Amazon Basic Care Acetaminophen,,off-label marketing
offlabel_9,10,Potential off‑label marketing of MIRENA with limited adverse event data – unlikely to support a new qui tam claim,30,"The record references FDA FAERS adverse event reports for MIRENA, an off‑label use scenario. No Medicare or Medicaid billing information is provided, and the data set is small (16 reports). While off‑label marketing can implicate FDCA violations, it does not constitute a False Claims Act violation unless there is evidence of false billing to federal programs. Therefore the case has limited qui tam potential.","16 FDA FAERS adverse event reports for MIRENA; 1 serious outcome, 3 unknown outcomes; Indication diversity of 2 (suggesting off‑label use); No mention of Medicare/Medicaid billing; Next step recommended: verify Medicare coverage and prescribing patterns",FDCA,MIRENA,,other
offlabel_10,11,Potential off‑label omeprazole prescribing with limited adverse event data – requires verification of Medicare involvement,50,"The record shows 15 adverse event reports for omeprazole, but there is no explicit evidence of Medicare/Medicaid billing or a documented pattern of false claims. The data are limited to FDA FAERS and lack dollar amounts, billing records, or a clear systematic practice. The score reflects the need for additional evidence to determine federal program involvement and potential damages.",15 adverse event reports for omeprazole in FDA FAERS; 5 serious outcomes reported among the 15 events; Indication diversity of 3 suggests possible off‑label use; No Medicare or Medicaid billing data provided,False Claims Act,Good Neighbor Pharmacy,,other
offlabel_11,12,Potential off‑label prescribing of prednisone that may involve Medicare billing and FDCA violations,70,"The record shows 15 adverse event reports linked to prednisone used for 8 different indications, indicating a pattern of off‑label use. If Medicare claims were submitted for these services, the case could violate both the FDCA and the False Claims Act. However, no direct evidence of Medicare billing is provided, so further investigation is required to confirm federal program involvement.",15 adverse event reports involving prednisone; 8 distinct indications suggesting off‑label use; 5 serious outcomes reported among the 15 events; Moderate adverse event volume indicates a potential pattern; Next steps recommend verifying Medicare coverage and prescribing patterns,False Claims Act; FDCA,Prednisone; FDA FAERS database,Medicare,off-label marketing
offlabel_12,13,Potential off‑label marketing of Bayer Genuine Aspirin with limited adverse event data,35,"The record indicates a modest number of adverse events (15) linked to off‑label use, but there is no evidence of Medicare/Medicaid billing or documented false claims. The lack of federal program involvement and the small event volume reduce qui tam viability to a low‑medium range.",15 adverse event reports in FAERS for Bayer Genuine Aspirin; 5 serious outcomes reported among those events; Indication diversity of 2 suggests possible off‑label use; No mention of Medicare/Medicaid billing or claims data,FDCA,Bayer,,off-label marketing
offlabel_13,14,Potential off‑label prescribing of Revlimid with limited adverse event data – unclear federal program involvement,35,"The record only reports 14 FAERS adverse event reports for Revlimid with no explicit mention of Medicare/Medicaid billing or claims. The data suggest possible off‑label use, but without evidence of false claims or federal program billing, the case falls into a low‑priority category.","14 FAERS adverse event reports for Revlimid; 2 serious outcomes, 5 moderate, 1 mild; Indication diversity of 2 suggests possible off‑label use; No Medicare/Medicaid billing data provided",False Claims Act; Anti-Kickback Statute; Stark Law; FDCA,Revlimid,,off-label marketing
offlabel_14,15,Potential off‑label marketing of Rituxan with moderate adverse event volume and unclear Medicare involvement,50,"The record indicates 14 FAERS reports for Rituxan with serious outcomes, suggesting possible off‑label promotion. However, there is no explicit mention of Medicare/Medicaid billing or documented false claims, limiting the strength of a False Claims Act claim. The case remains unfiled and could be pursued if Medicare coverage or billing patterns are later confirmed.","14 FAERS adverse event reports for Rituxan; 5 serious outcomes, 6 serious outcomes reported; Indication diversity of 2 suggests off‑label use; No explicit Medicare/Medicaid billing data provided",False Claims Act; Anti-Kickback Statute,Rituxan,,off-label marketing
offlabel_15,16,Potential off‑label methotrexate marketing scheme with 13 serious adverse events across 8 indications that may have led to false Medicare claims,75,"The record shows a moderate volume of serious adverse events linked to methotrexate used off‑label for 8 different indications, suggesting a systematic marketing practice that could have driven Medicare billing. While no explicit Medicare claims data are provided, the next steps recommend verifying coverage and prescribing patterns, indicating a clear opportunity for further investigation under the False Claims Act.",13 adverse event reports linked to methotrexate; 5 serious outcomes among the 13 events; 8 distinct indications indicating off‑label use; Moderate adverse event volume suggests a pattern rather than isolated incidents; Next steps call for verification of Medicare coverage and prescribing patterns,False Claims Act; Anti‑Kickback Statute,Methotrexate manufacturer,Medicare,off-label marketing
offlabel_16,17,Potential off‑label prescribing of GILENYA with 13 adverse event reports and unclear Medicare involvement,50,"The record indicates 13 adverse event reports for GILENYA, a drug with known off‑label use concerns.  No explicit Medicare/Medicaid billing data or documented false claims are present, and the adverse events alone do not establish a clear pattern of fraudulent billing.  The case is therefore considered medium potential pending further investigation into prescribing patterns and federal program involvement.",13 adverse event reports for GILENYA in FDA FAERS; 5 serious outcomes reported among the 13 events; Indication diversity of 2 suggests possible off‑label use; No Medicare/Medicaid billing data provided in the record,False Claims Act; Anti-Kickback Statute,GILENYA,,other
offlabel_17,18,Potential off‑label etoposide prescribing that may generate false Medicare claims,55,"The record indicates 13 adverse event reports for etoposide, a drug with only one indication listed. While no direct Medicare billing data is provided, the next step explicitly calls for verification of Medicare coverage and prescribing patterns. If off‑label use is widespread among Medicare beneficiaries, it could create a False Claims Act exposure. The lack of documented billing amounts or patterns keeps the score in the medium range.","13 adverse event reports for etoposide in FAERS; 5 serious outcomes among those reports; Only one indication listed for the drug, suggesting off‑label use; Next steps call for verifying Medicare coverage and prescribing patterns",False Claims Act,Unknown provider using etoposide off‑label,,off-label marketing / potential false claims
offlabel_18,19,"Potential off‑label marketing of NIGHTIME SLEEP AID with 13 adverse event reports, but no confirmed Medicare billing evidence",45,"The record indicates a moderate volume of adverse events for an off‑label drug, but there is no explicit mention of Medicare or Medicaid billing. Without evidence that false claims were submitted for federal programs, the case falls into a medium‑low viability range. Further investigation is needed to confirm any federal program involvement and potential damages.",13 adverse event reports filed in FDA FAERS for NIGHTIME SLEEP AID; 5 serious outcomes among those reports; Indication diversity of 1 suggests limited therapeutic use; No mention of Medicare or Medicaid billing in the record,False Claims Act; Anti-Kickback Statute,NIGHTIME SLEEP AID manufacturer,,off-label marketing
offlabel_19,20,Potential off‑label prescribing of lisinopril with 11 adverse event reports – requires verification of Medicare involvement,50,"The record indicates 11 adverse event reports for lisinopril with serious outcomes, suggesting possible off‑label use. However, there is no explicit mention of Medicare/Medicaid billing or documented claims fraud, and the data come from FDA FAERS rather than provider billing records. The case is therefore a medium‑potential opportunity that needs further evidence of federal program involvement and billing patterns.","11 adverse event reports for lisinopril in FDA FAERS; Serious outcomes reported (2, 1, 3, 6); Indication diversity of 3 suggests possible off‑label prescribing; No direct evidence of Medicare/Medicaid billing or claims fraud",False Claims Act; Anti-Kickback Statute,Unknown provider prescribing lisinopril,,other
offlabel_20,21,Potential off‑label marketing of SANDOSTATIN LAR DEPOT with moderate adverse event reports,35,"The record indicates 11 adverse event reports for an off‑label drug, but there is no explicit mention of Medicare/Medicaid billing or federal program involvement. The lack of a clear pattern of false claims and the absence of documented financial impact lower the score to medium‑low. Further investigation is needed to confirm any federal program billing and potential damages.",11 adverse event reports for SANDOSTATIN LAR DEPOT; 5 serious outcomes reported among the 11 events; Indication diversity of 2 suggests possible off‑label use; No explicit Medicare/Medicaid billing data provided,False Claims Act; Anti-Kickback Statute,SANDOSTATIN LAR DEPOT manufacturer,,off-label marketing
offlabel_21,22,Potential off‑label marketing of Clozaril with limited adverse event data – unclear Medicare billing involvement,45,"The record indicates 11 FAERS reports for off‑label use of Clozaril, but there is no explicit mention of Medicare or Medicaid billing. Without evidence that false claims were submitted for federal programs, the case falls into a low‑to‑medium range. Further investigation is needed to confirm whether Medicare claims were filed for these off‑label prescriptions.",11 FAERS adverse event reports for Clozaril; Indication diversity of 1 (suggesting limited therapeutic use); Serious outcomes reported in 3 cases; No explicit Medicare/Medicaid billing data provided,False Claims Act; Anti‑Kickback Statute,Clozaril,,off-label marketing
offlabel_22,23,Potential off‑label prescribing of Allopurinol with limited adverse event data – unclear federal program involvement,35,"The record reports 10 FAERS adverse event reports for Allopurinol, but it does not mention Medicare or Medicaid billing. Without evidence of federal program involvement or documented false claims, the case falls below the 50‑point threshold for a viable qui tam filing. The data are too limited and lack a clear pattern of billing fraud.",10 FAERS adverse event reports for Allopurinol; 5 serious outcomes reported among the 10 events; Indication diversity score of 1 suggests limited therapeutic use; No mention of Medicare/Medicaid billing or claims data,False Claims Act; Anti-Kickback Statute; Stark Law; FDCA,Allopurinol,,other
offlabel_23,24,Potential off‑label marketing of Pradaxa with limited adverse event data and unclear Medicare billing patterns,55,"The record indicates off‑label prescribing of Pradaxa with a modest number of adverse events, but lacks direct evidence of Medicare/Medicaid billing fraud or documented financial loss. The case may involve FDCA violations and could trigger False Claims Act liability if Medicare claims were submitted for off‑label use, but the current evidence is weak and requires further investigation.",10 adverse event reports for Pradaxa in FAERS; Serious outcomes reported in 3 of the 10 cases; Indication diversity of 4 suggests possible off‑label use; No direct Medicare or Medicaid billing data provided,FDCA,Pradaxa manufacturer: Allergan/AbbVie,,off-label marketing
offlabel_24,25,Potential off‑label prescribing of cyclophosphamide that may trigger false claims for Medicare billing,55,"The record shows a pattern of cyclophosphamide prescribed for six different indications, with nine adverse events and multiple serious outcomes. While the data come from FDA FAERS and do not yet confirm Medicare billing, the diversity of indications suggests possible off‑label use that could be billed to federal programs. The case is unfiled and no public settlement or DOJ announcement has been noted, but further evidence of Medicare claims is required to confirm a viable False Claims Act claim.","Cyclophosphamide prescribed for six distinct indications; Nine adverse events reported, five serious outcomes; Off‑label use may be billed to Medicare/Medicaid if not medically justified; Record originates from FDA FAERS, indicating potential regulatory concern",False Claims Act; FDCA,Unnamed prescribing provider,Medicare; Medicaid,off-label marketing
offlabel_25,26,Potential off‑label marketing of furosemide with limited adverse event data,30,"The record indicates a small number of adverse events and no explicit Medicare/Medicaid billing data. The only hint of federal program involvement is a suggestion to verify coverage, which is insufficient for a strong qui tam case. The limited adverse event count and lack of documented billing fraud keep the score low.",Drug: furosemide; 9 adverse events reported in FAERS; 2 serious outcomes among those events; Indication diversity of 4 suggests possible off‑label use; No Medicare/Medicaid billing data provided,False Claims Act; FDCA,FDA FAERS database,,off-label marketing
offlabel_26,27,Potential off‑label marketing of Plavix with limited evidence of Medicare involvement,30,The record indicates possible off‑label use of Plavix but provides no evidence that Medicare or Medicaid claims were submitted for these uses. The limited adverse event data and lack of billing documentation keep the case in the low‑priority range.,Plavix was reported in 9 FAERS cases with serious outcomes; Indication diversity of 3 suggests possible off‑label uses; No Medicare/Medicaid billing data provided,False Claims Act; FDCA,Plavix,,off-label marketing
offlabel_27,28,Potential off‑label marketing of Ventrixyl with limited evidence of Medicare involvement,30,"The record indicates off‑label use of Ventrixyl but provides no evidence that Medicare or Medicaid claims were submitted for these prescriptions. The lack of federal program mention and the absence of documented billing patterns keep the score low, though further investigation into prescribing data could raise the potential.","Drug Ventrixyl reported in FDA FAERS with 9 adverse events; 2 serious outcomes, 1 death, 3 hospitalizations, 6 life‑threatening events; Indication diversity of 4 suggests off‑label use; No mention of Medicare/Medicaid billing or claims data",False Claims Act; Anti-Kickback Statute,Ventrixyl manufacturer,,off-label marketing
offlabel_28,29,Off‑label prescribing of Lyrica with limited adverse event data – low qui tam potential,30,"The record only indicates off‑label use of Lyrica and a small number of adverse events reported to FAERS. No explicit Medicare/Medicaid billing or claims data are provided, and the adverse event count is low. The lack of federal program involvement and limited evidence keeps the score at 30.",FAERS record lists 8 adverse events for Lyrica; 5 serious outcomes reported among those events; Indication diversity of 4 suggests off‑label use; No Medicare or Medicaid billing data provided,False Claims Act,Unknown prescriber / provider,,other
offlabel_29,30,Potential off‑label prescribing of lorazepam with limited evidence of Medicare involvement,30,The record indicates off‑label use of lorazepam but provides no evidence that Medicare or Medicaid claims were submitted. The limited adverse event data and lack of billing information keep the case in the low‑priority range.,"Lorazepam was reported in 8 FAERS cases with serious outcomes.; Indication diversity is only 2, suggesting limited therapeutic use.; No Medicare or Medicaid billing data are provided.",False Claims Act; Anti-Kickback Statute,Lorazepam,,off-label marketing
offlabel_30,31,Potential off‑label marketing of Metformin Hydrochloride with limited adverse event data,30,"The record indicates a small number of adverse events and no explicit mention of Medicare/Medicaid billing or false claims. The only hint is a need to verify off‑label prescribing, which alone does not meet the threshold for a strong qui tam opportunity. The case is likely too weak and may be outside federal program coverage.",Metformin Hydrochloride reported in FDA FAERS with 8 adverse events; 5 serious outcomes among the reports; Indication diversity of 3 suggests possible off‑label use; No Medicare or Medicaid billing data provided,False Claims Act; Anti-Kickback Statute; Stark Law; FDCA,,,off-label marketing
